experiment_id	level	status	pnl	win_rate	brier_score	trades	cycles	description	started_at	finished_at
P0001	params	discard	0.0000	0.0000	0.0000	0	10	max_position_pct: 0.25 -> 0.2	2026-03-15T17:17:52.685698	2026-03-15T17:17:52.685722
P0002	params	discard	0.0000	0.0000	0.0000	0	10	min_edge: 0.04 -> 0.05	2026-03-15T18:04:54.334875	2026-03-15T18:04:54.334891
R0001_direct	prompt	discard	0.0000	0.0000	0.0000	0	10	user_prompt: Shorter user prompt, less chain-of-thought guidance	2026-03-15T18:47:52.664922	2026-03-15T18:47:52.664933
P0003	params	discard	0.0000	0.0000	0.0000	0	10	min_confidence: 0.6 -> 0.65	2026-03-15T19:29:24.688817	2026-03-15T19:29:24.688837
M0001	meta	keep	0.0000	0.0000	0.0000	5	0	Meta-analysis: 1 insights, 1 applied	2026-03-16T00:35:42.786116	2026-03-16T00:35:42.786127
R0002_sports_expert	prompt	discard	0.0000	0.0000	0.0000	0	10	system_prompt: Sports-specific analysis with stats focus	2026-03-16T15:05:51.791492	2026-03-16T15:05:51.791506
P0004	params	discard	0.0000	0.0000	0.0000	0	10	news_lookback_hours: 12 -> 16	2026-03-16T18:29:34.783268	2026-03-16T18:29:34.783285
P0005	params	discard	0.0000	0.0000	0.0000	0	10	llm_bias_correction: 0.04 -> 0.06	2026-03-16T22:08:47.204524	2026-03-16T22:08:47.204535
R0003_aggressive	prompt	discard	0.0000	0.0000	0.0000	0	10	system_prompt: Encourage independent thinking, disagree with market more	2026-03-17T14:39:47.761123	2026-03-17T14:39:47.761140
M0002	meta	keep	0.0000	0.0000	0.0000	5	0	Meta-analysis: 1 insights, 1 applied	2026-03-17T19:01:50.386781	2026-03-17T19:01:50.386802
P0006	params	discard	0.0000	0.0000	0.0000	0	10	top_markets_to_analyze: 20 -> 25	2026-03-17T20:33:47.010622	2026-03-17T20:33:47.010643
R0004_bayesian	prompt	discard	0.0000	0.0000	0.0000	0	10	system_prompt: Explicit Bayesian updating from base rate	2026-03-17T21:54:48.594059	2026-03-17T21:54:48.594074
P0007	params	discard	0.0000	0.0000	0.0000	0	10	max_hours_to_resolution: 48 -> 54	2026-03-17T23:21:47.453705	2026-03-17T23:21:47.453722
P0008	params	discard	0.0000	0.0000	0.0000	0	10	max_hours_to_resolution: 48 -> 42	2026-03-18T00:36:13.936490	2026-03-18T00:36:13.936501
M0003	meta	keep	0.0000	0.0000	0.0000	5	0	Meta-analysis: 1 insights, 1 applied	2026-03-18T01:31:50.261689	2026-03-18T01:31:50.261693
P0009	params	discard	0.0000	0.0000	0.0000	0	10	llm_bias_correction: 0.04 -> 0.06	2026-03-18T02:01:50.276956	2026-03-18T02:01:50.276977
P0010	params	discard	0.0000	0.0000	0.0000	0	10	max_hours_to_resolution: 48 -> 54	2026-03-18T02:31:50.385071	2026-03-18T02:31:50.385084
P0001	params	discard	0.0000	0.0000	0.0000	0	10	max_position_pct: 0.25 -> 0.2	2026-03-18T04:10:51.124621	2026-03-18T04:10:51.124637
P0002	params	discard	0.0000	0.0000	0.0000	0	10	llm_bias_correction: 0.04 -> 0.06	2026-03-18T05:16:53.981507	2026-03-18T05:16:53.981527
R0001_aggressive	prompt	discard	0.0000	0.0000	0.0000	0	10	system_prompt: Encourage independent thinking, disagree with market more	2026-03-18T06:32:01.489359	2026-03-18T06:32:01.489374
P0003	params	discard	0.0000	0.0000	0.0000	0	10	min_confidence: 0.7 -> 0.75	2026-03-18T07:58:17.220459	2026-03-18T07:58:17.220469
M0001	meta	keep	0.0000	0.0000	0.0000	5	0	Meta-analysis: 1 insights, 1 applied	2026-03-18T09:31:49.911090	2026-03-18T09:31:49.911097
R0002_sports_expert	prompt	discard	0.0000	0.0000	0.0000	0	10	system_prompt: Sports-specific analysis with stats focus	2026-03-18T11:04:15.133445	2026-03-18T11:04:15.133455
P0004	params	discard	0.0000	0.0000	0.0000	0	10	min_edge: 0.04 -> 0.05	2026-03-18T12:36:58.262762	2026-03-18T12:36:58.262774
P0005	params	discard	0.0000	0.0000	0.0000	0	10	kelly_fraction: 0.25 -> 0.3	2026-03-18T14:13:10.021473	2026-03-18T14:13:10.021482
R0003_contrarian	prompt	discard	0.0000	0.0000	0.0000	0	10	system_prompt: Look for overreactions and fade the crowd	2026-03-18T15:40:02.261148	2026-03-18T15:40:02.261164
P0001	params	keep	2.6300	0.0000	0.0000	5	10	max_hours_to_resolution: 48 -> 42	2026-03-18T19:12:15.000496	2026-03-18T19:12:15.000507
P0002	params	discard	0.0000	0.0000	0.0000	0	10	llm_bias_correction: 0.04 -> 0.06	2026-03-18T20:01:16.573187	2026-03-18T20:01:16.573196
R0001_market_context	prompt	discard	0.0000	0.0000	0.0000	0	10	user_prompt: Add market efficiency context	2026-03-18T21:21:26.390822	2026-03-18T21:21:26.390849
P0003	params	discard	0.0000	0.0000	0.0000	0	10	news_lookback_hours: 12 -> 16	2026-03-18T22:51:19.940382	2026-03-18T22:51:19.940403
M0001	meta	keep	0.0000	0.0000	0.0000	10	0	Meta-analysis: 1 insights, 1 applied	2026-03-19T00:30:11.745597	2026-03-19T00:30:11.745602
R0002_sports_expert	prompt	discard	0.0000	0.0000	0.0000	0	10	system_prompt: Sports-specific analysis with stats focus	2026-03-19T01:34:15.754675	2026-03-19T01:34:15.754690
P0004	params	discard	0.0000	0.0000	0.0000	0	10	min_edge: 0.04 -> 0.03	2026-03-19T02:04:15.795912	2026-03-19T02:04:15.795928
P0005	params	discard	0.0000	0.0000	0.0000	0	10	kelly_fraction: 0.25 -> 0.2	2026-03-19T02:34:16.184463	2026-03-19T02:34:16.184480
R0003_contrarian	prompt	discard	0.0000	0.0000	0.0000	0	10	system_prompt: Look for overreactions and fade the crowd	2026-03-19T04:01:13.559009	2026-03-19T04:01:13.559018
M0002	meta	keep	0.0000	0.0000	0.0000	10	0	Meta-analysis: 1 insights, 1 applied	2026-03-19T04:31:15.888834	2026-03-19T04:31:15.888841
P0006	params	discard	0.0000	0.0000	0.0000	0	10	top_markets_to_analyze: 20 -> 25	2026-03-19T05:01:15.775959	2026-03-19T05:01:15.775971
R0004_direct	prompt	discard	0.0000	0.0000	0.0000	0	10	user_prompt: Shorter user prompt, less chain-of-thought guidance	2026-03-19T05:31:15.878228	2026-03-19T05:31:15.878239
P0007	params	discard	0.0000	0.0000	0.0000	0	10	top_markets_to_analyze: 20 -> 25	2026-03-19T06:01:15.904152	2026-03-19T06:01:15.904161
P0008	params	discard	0.0000	0.0000	0.0000	0	10	min_edge: 0.04 -> 0.03	2026-03-19T06:31:15.792768	2026-03-19T06:31:15.792776
M0003	meta	keep	0.0000	0.0000	0.0000	10	0	Meta-analysis: 1 insights, 1 applied	2026-03-19T07:01:16.199634	2026-03-19T07:01:16.199640
P0009	params	discard	0.0000	0.0000	0.0000	0	10	min_confidence: 0.7 -> 0.65	2026-03-19T07:31:15.833799	2026-03-19T07:31:15.833811
P0010	params	discard	0.0000	0.0000	0.0000	0	10	llm_bias_correction: 0.04 -> 0.06	2026-03-19T08:01:15.925345	2026-03-19T08:01:15.925361
R0005_direct	prompt	discard	0.0000	0.0000	0.0000	0	10	user_prompt: Shorter user prompt, less chain-of-thought guidance	2026-03-19T08:31:16.052583	2026-03-19T08:31:16.052599
P0011	params	discard	0.0000	0.0000	0.0000	0	10	max_hours_to_resolution: 42 -> 36	2026-03-19T09:01:16.078654	2026-03-19T09:01:16.078666
M0004	meta	keep	0.0000	0.0000	0.0000	10	0	Meta-analysis: 1 insights, 1 applied	2026-03-19T09:31:15.795565	2026-03-19T09:31:15.795573
R0006_market_context	prompt	discard	0.0000	0.0000	0.0000	0	10	user_prompt: Add market efficiency context	2026-03-19T10:01:15.883094	2026-03-19T10:01:15.883106
P0012	params	discard	0.0000	0.0000	0.0000	0	10	top_markets_to_analyze: 20 -> 25	2026-03-19T10:31:16.211806	2026-03-19T10:31:16.211817
P0013	params	discard	0.0000	0.0000	0.0000	0	10	min_confidence: 0.7 -> 0.75	2026-03-19T11:01:15.841022	2026-03-19T11:01:15.841034
R0007_minimal	prompt	discard	0.0000	0.0000	0.0000	0	10	system_prompt: Minimal prompt, let model use its own reasoning	2026-03-19T11:31:15.808662	2026-03-19T11:31:15.808675
M0005	meta	keep	0.0000	0.0000	0.0000	10	0	Meta-analysis: 1 insights, 1 applied	2026-03-19T12:01:15.881986	2026-03-19T12:01:15.881996
P0014	params	discard	0.0000	0.0000	0.0000	0	10	news_lookback_hours: 12 -> 16	2026-03-19T12:31:15.795298	2026-03-19T12:31:15.795308
R0008_scoring	prompt	discard	0.0000	0.0000	0.0000	0	10	system_prompt: Explicit evidence scoring before probability	2026-03-19T13:01:15.848576	2026-03-19T13:01:15.848586
P0015	params	discard	0.0000	0.0000	0.0000	0	10	top_markets_to_analyze: 20 -> 15	2026-03-19T13:31:15.873542	2026-03-19T13:31:15.873553
P0016	params	discard	0.0000	0.0000	0.0000	0	10	kelly_fraction: 0.25 -> 0.2	2026-03-19T14:01:16.021455	2026-03-19T14:01:16.021468
M0006	meta	keep	0.0000	0.0000	0.0000	10	0	Meta-analysis: 1 insights, 1 applied	2026-03-19T14:31:15.954901	2026-03-19T14:31:15.954908
P0017	params	discard	0.0000	0.0000	0.0000	0	10	max_position_pct: 0.25 -> 0.3	2026-03-19T15:01:16.265628	2026-03-19T15:01:16.265639
P0018	params	discard	0.0000	0.0000	0.0000	0	10	kelly_fraction: 0.25 -> 0.3	2026-03-19T15:31:15.785824	2026-03-19T15:31:15.785836
R0009_aggressive	prompt	discard	0.0000	0.0000	0.0000	0	10	system_prompt: Encourage independent thinking, disagree with market more	2026-03-19T16:01:16.027990	2026-03-19T16:01:16.028004
P0019	params	discard	0.0000	0.0000	0.0000	0	10	max_hours_to_resolution: 42 -> 36	2026-03-19T16:31:15.874234	2026-03-19T16:31:15.874246
M0007	meta	keep	0.0000	0.0000	0.0000	10	0	Meta-analysis: 1 insights, 1 applied	2026-03-19T17:01:16.049660	2026-03-19T17:01:16.049666
R0010_direct	prompt	discard	0.0000	0.0000	0.0000	0	10	user_prompt: Shorter user prompt, less chain-of-thought guidance	2026-03-19T17:31:15.846721	2026-03-19T17:31:15.846737
P0020	params	discard	0.0000	0.0000	0.0000	0	10	max_hours_to_resolution: 42 -> 36	2026-03-19T18:01:15.855026	2026-03-19T18:01:15.855039
P0021	params	discard	0.0000	0.0000	0.0000	0	10	min_edge: 0.04 -> 0.05	2026-03-19T18:31:15.886320	2026-03-19T18:31:15.886337
R0011_direct	prompt	discard	0.0000	0.0000	0.0000	0	10	user_prompt: Shorter user prompt, less chain-of-thought guidance	2026-03-19T19:01:11.321307	2026-03-19T19:01:11.321328
M0008	meta	keep	0.0000	0.0000	0.0000	10	0	Meta-analysis: 1 insights, 1 applied	2026-03-19T20:39:18.003063	2026-03-19T20:39:18.003072
P0022	params	discard	0.0000	0.0000	0.0000	0	10	max_hours_to_resolution: 42 -> 36	2026-03-19T21:58:16.032717	2026-03-19T21:58:16.032732
R0012_bayesian	prompt	discard	0.0000	0.0000	0.0000	0	10	system_prompt: Explicit Bayesian updating from base rate	2026-03-19T22:28:15.779567	2026-03-19T22:28:15.779579
P0023	params	discard	0.0000	0.0000	0.0000	0	10	kelly_fraction: 0.25 -> 0.3	2026-03-19T22:58:15.774888	2026-03-19T22:58:15.774901
P0024	params	discard	0.0000	0.0000	0.0000	0	10	kelly_fraction: 0.25 -> 0.3	2026-03-19T23:28:15.781915	2026-03-19T23:28:15.781927
M0009	meta	keep	0.0000	0.0000	0.0000	10	0	Meta-analysis: 1 insights, 1 applied	2026-03-19T23:58:16.013972	2026-03-19T23:58:16.013977
P0025	params	discard	0.0000	0.0000	0.0000	0	10	kelly_fraction: 0.25 -> 0.3	2026-03-20T00:28:15.770382	2026-03-20T00:28:15.770392
P0026	params	discard	0.0000	0.0000	0.0000	0	10	max_position_pct: 0.25 -> 0.2	2026-03-20T00:58:16.002824	2026-03-20T00:58:16.002837
R0013_scoring	prompt	discard	0.0000	0.0000	0.0000	0	10	system_prompt: Explicit evidence scoring before probability	2026-03-20T01:28:16.020755	2026-03-20T01:28:16.020768
P0027	params	discard	0.0000	0.0000	0.0000	0	10	min_edge: 0.04 -> 0.03	2026-03-20T01:58:15.761075	2026-03-20T01:58:15.761088
M0010	meta	keep	0.0000	0.0000	0.0000	10	0	Meta-analysis: 1 insights, 1 applied	2026-03-20T02:28:15.794113	2026-03-20T02:28:15.794119
R0014_aggressive	prompt	discard	0.0000	0.0000	0.0000	0	10	system_prompt: Encourage independent thinking, disagree with market more	2026-03-20T02:58:15.770754	2026-03-20T02:58:15.770766
P0028	params	discard	0.0000	0.0000	0.0000	0	10	min_edge: 0.04 -> 0.05	2026-03-20T03:28:16.022383	2026-03-20T03:28:16.022395
P0029	params	discard	0.0000	0.0000	0.0000	0	10	max_position_pct: 0.25 -> 0.3	2026-03-20T03:58:15.777270	2026-03-20T03:58:15.777279
R0015_contrarian	prompt	discard	0.0000	0.0000	0.0000	0	10	system_prompt: Look for overreactions and fade the crowd	2026-03-20T04:28:15.778464	2026-03-20T04:28:15.778479
M0011	meta	keep	0.0000	0.0000	0.0000	10	0	Meta-analysis: 1 insights, 1 applied	2026-03-20T04:58:15.846749	2026-03-20T04:58:15.846765
P0030	params	discard	0.0000	0.0000	0.0000	0	10	min_edge: 0.04 -> 0.03	2026-03-20T05:28:16.007688	2026-03-20T05:28:16.007704
R0016_bayesian	prompt	discard	0.0000	0.0000	0.0000	0	10	system_prompt: Explicit Bayesian updating from base rate	2026-03-20T05:58:15.788189	2026-03-20T05:58:15.788205
P0031	params	discard	0.0000	0.0000	0.0000	0	10	kelly_fraction: 0.25 -> 0.2	2026-03-20T06:28:16.093012	2026-03-20T06:28:16.093024
P0032	params	discard	0.0000	0.0000	0.0000	0	10	max_hours_to_resolution: 42 -> 36	2026-03-20T06:58:15.797017	2026-03-20T06:58:15.797035
M0012	meta	keep	0.0000	0.0000	0.0000	10	0	Meta-analysis: 1 insights, 1 applied	2026-03-20T07:28:15.798277	2026-03-20T07:28:15.798283
P0033	params	discard	0.0000	0.0000	0.0000	0	10	top_markets_to_analyze: 20 -> 15	2026-03-20T07:58:16.375266	2026-03-20T07:58:16.375275
P0034	params	discard	0.0000	0.0000	0.0000	0	10	max_hours_to_resolution: 42 -> 48	2026-03-20T08:28:15.932515	2026-03-20T08:28:15.932525
R0017_market_context	prompt	discard	0.0000	0.0000	0.0000	0	10	user_prompt: Add market efficiency context	2026-03-20T08:58:15.858911	2026-03-20T08:58:15.858925
P0035	params	discard	0.0000	0.0000	0.0000	0	10	top_markets_to_analyze: 20 -> 15	2026-03-20T09:28:16.036251	2026-03-20T09:28:16.036264
M0013	meta	keep	0.0000	0.0000	0.0000	10	0	Meta-analysis: 1 insights, 1 applied	2026-03-20T09:58:15.814058	2026-03-20T09:58:15.814064
R0018_market_context	prompt	discard	0.0000	0.0000	0.0000	0	10	user_prompt: Add market efficiency context	2026-03-20T10:28:15.803379	2026-03-20T10:28:15.803389
P0036	params	discard	0.0000	0.0000	0.0000	0	10	max_position_pct: 0.25 -> 0.2	2026-03-20T10:58:15.801738	2026-03-20T10:58:15.801753
P0037	params	discard	0.0000	0.0000	0.0000	0	10	news_lookback_hours: 12 -> 8	2026-03-20T11:28:15.884124	2026-03-20T11:28:15.884139
R0019_sports_expert	prompt	discard	0.0000	0.0000	0.0000	0	10	system_prompt: Sports-specific analysis with stats focus	2026-03-20T11:58:15.797333	2026-03-20T11:58:15.797349
M0014	meta	keep	0.0000	0.0000	0.0000	10	0	Meta-analysis: 1 insights, 1 applied	2026-03-20T12:28:15.809334	2026-03-20T12:28:15.809340
P0038	params	discard	0.0000	0.0000	0.0000	0	10	llm_bias_correction: 0.04 -> 0.06	2026-03-20T12:58:15.881576	2026-03-20T12:58:15.881586
R0020_minimal	prompt	discard	0.0000	0.0000	0.0000	0	10	system_prompt: Minimal prompt, let model use its own reasoning	2026-03-20T13:28:16.191237	2026-03-20T13:28:16.191249
P0039	params	discard	0.0000	0.0000	0.0000	0	10	top_markets_to_analyze: 20 -> 15	2026-03-20T13:58:15.995653	2026-03-20T13:58:15.995661
P0040	params	discard	0.0000	0.0000	0.0000	0	10	news_lookback_hours: 12 -> 16	2026-03-20T14:28:16.079519	2026-03-20T14:28:16.079535
M0015	meta	keep	0.0000	0.0000	0.0000	10	0	Meta-analysis: 1 insights, 1 applied	2026-03-20T14:58:16.019263	2026-03-20T14:58:16.019267
P0041	params	discard	0.0000	0.0000	0.0000	0	10	news_lookback_hours: 12 -> 8	2026-03-20T16:21:39.852608	2026-03-20T16:21:39.852623
P0042	params	discard	0.0000	0.0000	0.0000	0	10	max_hours_to_resolution: 42 -> 36	2026-03-20T17:45:16.370000	2026-03-20T17:45:16.370011
R0021_contrarian	prompt	discard	0.0000	0.0000	0.0000	0	10	system_prompt: Look for overreactions and fade the crowd	2026-03-20T19:15:26.591031	2026-03-20T19:15:26.591036
P0043	params	discard	0.0000	0.0000	0.0000	0	10	llm_bias_correction: 0.04 -> 0.02	2026-03-20T21:07:00.792880	2026-03-20T21:07:00.792896
M0016	meta	keep	0.0000	0.0000	0.0000	10	0	Meta-analysis: 1 insights, 1 applied	2026-03-20T22:36:11.540772	2026-03-20T22:36:11.540782
R0022_sports_expert	prompt	discard	0.0000	0.0000	0.0000	0	10	system_prompt: Sports-specific analysis with stats focus	2026-03-21T00:06:50.676941	2026-03-21T00:06:50.676954
P0044	params	discard	0.0000	0.0000	0.0000	0	10	llm_bias_correction: 0.04 -> 0.02	2026-03-21T01:23:52.739520	2026-03-21T01:23:52.739535
P0045	params	discard	0.0000	0.0000	0.0000	0	10	max_hours_to_resolution: 42 -> 36	2026-03-21T02:29:26.960824	2026-03-21T02:29:26.960837
R0023_bayesian	prompt	discard	0.0000	0.0000	0.0000	0	10	system_prompt: Explicit Bayesian updating from base rate	2026-03-21T03:29:01.496438	2026-03-21T03:29:01.496451
M0017	meta	keep	0.0000	0.0000	0.0000	10	0	Meta-analysis: 1 insights, 1 applied	2026-03-21T04:28:07.605925	2026-03-21T04:28:07.605931
P0046	params	discard	0.0000	0.0000	0.0000	0	10	max_position_pct: 0.25 -> 0.2	2026-03-21T05:29:15.172471	2026-03-21T05:29:15.172490
R0024_market_context	prompt	discard	0.0000	0.0000	0.0000	0	10	user_prompt: Add market efficiency context	2026-03-21T06:29:51.087439	2026-03-21T06:29:51.087462
P0047	params	discard	0.0000	0.0000	0.0000	0	10	min_confidence: 0.7 -> 0.65	2026-03-21T07:51:10.275954	2026-03-21T07:51:10.275975
P0048	params	discard	0.0000	0.0000	0.0000	0	10	min_edge: 0.04 -> 0.05	2026-03-21T09:18:53.022345	2026-03-21T09:18:53.022357
M0018	meta	keep	0.0000	0.0000	0.0000	10	0	Meta-analysis: 1 insights, 1 applied	2026-03-21T10:48:17.166260	2026-03-21T10:48:17.166265
P0049	params	discard	0.0000	0.0000	0.0000	0	10	max_position_pct: 0.25 -> 0.3	2026-03-21T12:18:20.714506	2026-03-21T12:18:20.714521
P0050	params	discard	0.0000	0.0000	0.0000	0	10	top_markets_to_analyze: 20 -> 25	2026-03-21T13:48:15.547523	2026-03-21T13:48:15.547536
R0025_aggressive	prompt	discard	0.0000	0.0000	0.0000	0	10	system_prompt: Encourage independent thinking, disagree with market more	2026-03-21T15:19:44.505443	2026-03-21T15:19:44.505455
P0051	params	discard	0.0000	0.0000	0.0000	0	10	min_edge: 0.04 -> 0.03	2026-03-21T16:39:37.911473	2026-03-21T16:39:37.911488
